[
  {
    "article_id": "24f1a9774a819c7be23e721502d5e0e84d613c4fb1be862657b1262919b60dc5",
    "source_id": "vn_sbv_regulatory_docs",
    "source_item_id": "sbv-2026-0842",
    "url": "https://example.invalid/vn/thong-tu-lai-suat?utm_source=feed",
    "canonical_url": "https://example.invalid/vn/thong-tu-lai-suat",
    "title": "Synthetic: Ngân hàng Nhà nước điều chỉnh trần lãi suất huy động ngắn hạn",
    "description": "Bản tin tổng hợp về việc điều chỉnh trần lãi suất huy động kỳ hạn dưới sáu tháng và lộ trình áp dụng đối với các tổ chức tín dụng.",
    "language": "vi",
    "market": "VN",
    "published_at": "2026-08-16T02:15:00Z",
    "discovered_at": "2026-08-16T02:20:00Z",
    "content_hash": "f136fa590fb93578adc03197839127e65d799a8dbd2676b7fda36b5883f1f134"
  },
  {
    "article_id": "84c01e2c2451dafcfdefb80861985669af5e64efb551c374bdce73766f4fdafa",
    "source_id": "cn_pboc_regulatory_docs",
    "source_item_id": null,
    "url": "https://example.invalid/cn/pboc-policy-notice",
    "canonical_url": "https://example.invalid/cn/pboc-policy-notice",
    "title": "Synthetic: 中国人民银行发布宏观审慎评估参数调整通知",
    "description": "关于宏观审慎评估参数调整的合成测试摘要，用于前端渲染验证。",
    "language": "zh",
    "market": "CN",
    "published_at": "2026-08-16T03:00:00Z",
    "discovered_at": "2026-08-16T03:05:00Z",
    "content_hash": "0cb10c2dc587c6a2b101bf5823dd340cd3db64b184949bd98cd593b6e91d8bb1"
  },
  {
    "article_id": "5eb9ca77bdf5d16058d83104bdce19219d9c947284ff729be6dfdd37726a620e",
    "source_id": "us_federal_register",
    "source_item_id": "fr-2026-17734",
    "url": "https://example.invalid/us/interagency-consultation",
    "canonical_url": "https://example.invalid/us/interagency-consultation",
    "title": "Synthetic: Joint interagency consultation on cross-border semiconductor export control alignment, renewable grid interconnection standards, and the supervisory treatment of algorithmic credit scoring under the revised prudential framework",
    "description": null,
    "language": "en",
    "market": "US",
    "published_at": "2026-08-16T13:45:00Z",
    "discovered_at": "2026-08-16T13:50:00Z",
    "content_hash": "fdbd624fea9912e70390ea0e0b21cab99585f1305ba3ab72a5c759af792a8352"
  },
  {
    "article_id": "f52322dd3341cd1d0412feee3bb93b697f7008be9f93374042db609a7ead8836",
    "source_id": "eu_ecb_press",
    "source_item_id": "ecb-2026-0311",
    "url": "https://example.invalid/eu/ecb-statement",
    "canonical_url": "https://example.invalid/eu/ecb-statement",
    "title": "Synthetic: ECB statement on digital euro settlement pilot",
    "description": "A synthetic statement used to demonstrate classifier versioning.",
    "language": "en",
    "market": "EU",
    "published_at": "2026-08-17T09:00:00Z",
    "discovered_at": "2026-08-17T09:04:00Z",
    "content_hash": "9fb4d0ac139c666b0327c2826152b320e834fde2cecf305f0ae728f28ab57d75"
  },
  {
    "article_id": "2cffb8f294323ff00c0294bbfb2778d957e7f98b2edb53af814d99db057baedf",
    "source_id": "us_sec_regulatory",
    "source_item_id": "sec-2026-5501",
    "url": "https://example.invalid/us/sec-enforcement-note",
    "canonical_url": "https://example.invalid/us/sec-enforcement-note",
    "title": "Synthetic: SEC note on disclosure obligations",
    "description": "Synthetic content used to demonstrate source muting.",
    "language": "en",
    "market": "US",
    "published_at": "2026-08-17T15:30:00Z",
    "discovered_at": "2026-08-17T15:33:00Z",
    "content_hash": "26f3d59ee2441ce973e57bf55f2109041c6cc71e8e3b260c3f210b51891c28cc"
  },
  {
    "article_id": "8f62d3d2857e663902a1ebf05d24261b47b1ecf5abb546201c09cd5dfe153347",
    "source_id": "eu_eurlex_cellar",
    "source_item_id": "cellar-2026-9004",
    "url": "https://example.invalid/eu/omnibus-regulation",
    "canonical_url": "https://example.invalid/eu/omnibus-regulation",
    "title": "Synthetic: Omnibus regulation touching every controlled topic",
    "description": "Synthetic article used to exercise maximum markets and topics per record.",
    "language": "en",
    "market": "EU",
    "published_at": null,
    "discovered_at": "2026-08-18T01:00:00Z",
    "content_hash": "faf607ea36c5d07f7261412a09f8a09f3300f20b2f63aced75b2f83e4b1fc454"
  },
  {
    "article_id": "c47cde5495461e7b93c01d1a6dd027d98337022de8ddd4aabb68a70fe4076a23",
    "source_id": "synthetic_snippet_approved_source",
    "source_item_id": "approved-0001",
    "url": "https://example.invalid/us/approved-snippet-item",
    "canonical_url": "https://example.invalid/us/approved-snippet-item",
    "title": "Synthetic: Item from a source whose snippet rights are APPROVED",
    "description": "This description MAY be rendered, because its source carries can_show_snippet=true and rights_review_status=APPROVED. Every other source in the pack denies snippet display.",
    "language": "en",
    "market": "US",
    "published_at": "2026-08-18T04:00:00Z",
    "discovered_at": "2026-08-18T04:03:00Z",
    "content_hash": "168b51955d075a37239e1f4008a243d0924b8f2cd44675f7f36eaefa8c7011b1"
  }
]
